{
  "event_id": "misa-case-provider-timeout-001",
  "channel": "local",
  "summary": "Provider read timeouts have appeared repeatedly and were handled by rollback or retry windows.",
  "signals": [
    "repeated_failure_pattern",
    "provider_timeout"
  ],
  "evidence_count": 2,
  "outcome": "partial",
  "risk_level": "medium",
  "redaction_status": "clean",
  "source_type": "synthetic",
  "redaction_note": "No provider payload or credential data; only the repeated timeout pattern is retained.",
  "setpoint": "recognize provider timeout as a known failure mode before changing routes",
  "artifact_evidence": {
    "injected": [],
    "read": [],
    "modified": [],
    "tool_errors": [
      "tool:provider-read-timeout"
    ]
  },
  "expected_route": "case",
  "expected_status": "draft",
  "expected_publication_mode": "draft_only",
  "expected_candidate_state": "staged",
  "created_at": "2026-05-10T00:00:00Z"
}
